Book Id,Title,Author,Author l-f,Additional Authors,ISBN,ISBN13,My Rating,Average Rating,Publisher,Binding,Number of Pages,Year Published,Original Publication Year,Date Read,Date Added,Bookshelves,Bookshelves with positions,Exclusive Shelf,My Review,Spoiler,Private Notes,Read Count,Owned Copies
1689970,"Ashes And Blood: The British Army In South Africa, 1795 1914",Alan J. Guy,"Guy, Alan J.","Peter B. Boyden, Marion Harding","=""0901721360""","=""9780901721365""",0,4.26,Spellmount Publishers,Paperback,520,2000,2000,,2024/09/22,to-read,to-read (#315),to-read,,,,0,0
1707116,The Forgotten 500: The Untold Story of the Men Who Risked All For the Greatest Rescue Mission of World War II,Gregory A. Freeman,"Freeman, Gregory A.",,"=""0451222121""","=""9780451222121""",0,4.07,NAL Hardcover,Hardcover,336,2007,2007,,2024/09/22,to-read,to-read (#314),to-read,,,,0,0
562407,Mr. Lincoln's Army,Bruce Catton,"Catton, Bruce",,"=""""","=""""",0,4.33,"Doubleday & Company, Inc.",Hardcover,372,1951,1951,,2024/09/22,to-read,to-read (#311),to-read,,,,0,0
224379,Gulag: A History,Anne Applebaum,"Applebaum, Anne",,"=""0767900561""","=""9780767900560""",0,4.28,Doubleday,Hardcover,677,2003,2003,,2024/09/22,to-read,to-read (#310),to-read,,,,0,0
25812847,Silk Roads,Peter Frankopan,"Frankopan, Peter",,"=""1408839970""","=""9781408839973""",0,4.18,Bloomsbury,Hardcover,636,2015,2015,,2024/09/22,to-read,to-read (#312),to-read,,,,0,0
37570548,The Five: The Untold Lives of the Women Killed by Jack the Ripper,Hallie Rubenhold,"Rubenhold, Hallie",,"=""""","=""""",0,4.11,Houghton Mifflin Harcourt,Hardcover,352,2019,2019,,2024/09/22,to-read,to-read (#313),to-read,,,,0,0
45529,Montaillou: The Promised Land of Error,Emmanuel Le Roy Ladurie,"Ladurie, Emmanuel Le Roy",Barbara Bray,"=""0394729641""","=""9780394729640""",0,3.98,Vintage/Random House (NY),Paperback,383,1979,1975,,2024/09/22,to-read,to-read (#304),to-read,,,,0,0
487666,Beyond Band of Brothers: The War Memoirs of Major Dick Winters,Dick Winters,"Winters, Dick",Cole C. Kingseed,"=""0425208133""","=""9780425208137""",0,4.32,Dutton Caliber,Hardcover,304,2006,2006,,2024/09/22,to-read,to-read (#305),to-read,,,,0,0
678699,Raj: The Making and Unmaking of British India,Lawrence James,"James, Lawrence",,"=""0312263821""","=""9780312263829""",0,3.81,St. Martin's Griffin,Paperback,722,2000,1997,,2024/09/22,to-read,to-read (#308),to-read,,,,0,0
609035,Foxe's Book of Martyrs,John Foxe,"Foxe, John",William Grinton Berry,"=""0800786645""","=""9780800786649""",0,4.26,Fleming H. Revell,Paperback,416,1999,1563,,2024/09/22,to-read,to-read (#307),to-read,,,,0,0
10954979,The Swerve: How the World Became Modern,Stephen Greenblatt,"Greenblatt, Stephen",,"=""0393064476""","=""9780393064476""",0,3.87,W. W. Norton & Company,Hardcover,356,2011,2011,,2024/09/22,to-read,to-read (#306),to-read,,,,0,0
22436324,The Reagan Casualties: Overseas Atrocities of the Great Communicator,Jacob T. Klezaras,"Klezaras, Jacob T.",,"=""0692233911""","=""9780692233917""",0,4.14,The Wollstone Book Group,Paperback,148,2014,2014,,2024/09/22,to-read,to-read (#305),to-read,,,,0,0
403124,The Washing of the Spears,Donald R. Morris,"Morris, Donald R.",,"=""0306808668""","=""9780306808661""",0,4.25,Da Capo Press,Paperback,693,1998,1965,,2024/09/22,to-read,to-read (#301),to-read,,,,0,0
527102,Blood-red Desert Sand (Cassell Military Trade Books),Michael Barthorp,"Barthorp, Michael",,"=""0304362239""","=""9780304362233""",0,4.32,Cassell Military,Hardcover,190,2002,2002,,2024/09/22,to-read,to-read (#302),to-read,,,,0,0
779807,In Search of the Trojan War,Michael Wood,"Wood, Michael",,"=""0520215990""","=""9780520215993""",0,4.09,University of California Press (Berkeley/LA),Paperback,288,1998,1985,,2024/09/22,to-read,to-read (#299),to-read,,,,0,0
801754,The Decline of the West,Oswald Spengler,"Spengler, Oswald","Charles Francis Atkinson, H. Stuart Hughes, Arthur Helps, Helmut Werner","=""0195066340""","=""9780195066340""",0,4.06,"Oxford University Press, USA",Paperback,486,1991,1918,,2024/09/22,to-read,to-read (#301),to-read,,,,0,0
442239,The Republic of Pirates: Being the True and Surprising Story of the Caribbean Pirates and the Man Who Brought Them Down,Colin Woodard,"Woodard, Colin",,"=""0151013020""","=""9780151013029""",0,3.87,Houghton Mifflin Harcourt,Hardcover,383,2007,2007,,2024/09/22,to-read,to-read (#299),to-read,,,,0,0
775405,Desire of the Everlasting Hills: The World Before and After Jesus,Thomas Cahill,"Cahill, Thomas",,"=""0385483724""","=""9780385483728""",0,3.96,Anchor,Paperback,353,2013,2013,,2024/09/22,to-read,to-read (#300),to-read,,,,0,0
7940583,Chasing the Devil: The Search for Africa's Fighting Spirit,Tim Butcher,"Butcher, Tim",,"=""0701183608""","=""9780701183608""",0,4.13,Chatto & Windus,Hardcover,336,2010,2010,,2024/09/22,to-read,to-read (#297),to-read,,,,0,0
10757346,Ain't No Grave: The Life and Legacy of Brother Claude Ely,Macel Ely II,"II, Macel Ely",,"=""0981734227""","=""9780981734224""",0,3.59,Dust to Digital,Hardcover,345,2011,2010,,2024/09/22,to-read,to-read (#298),to-read,,,,0,0
12143200,Drift,Rachel Maddow,"Maddow, Rachel",,"=""0307970388""","=""9780307970381""",0,4.07,Random House Audio,,288,2012,2012,,2024/09/22,to-read,to-read (#298),to-read,,,,0,0
23456467,"The Greatest Knight: The Remarkable Life of William Marshal, The Power Behind Five English Thrones",Thomas Asbridge,"Asbridge, Thomas",,"=""006226205X""","=""9780062262059""",0,4.26,Ecco ,Hardcover,464,2014,2014,,2024/09/22,to-read,to-read (#302),to-read,,,,0,0
65213190,"Into Siberia: George Kennan's Epic Journey Through the Brutal, Frozen Heart of Russia",Gregory J. Wallance,"Wallance, Gregory J.",,"=""1250280052""","=""9781250280053""",0,3.99,St. Martin's Press,Hardcover,304,2023,,,2024/09/22,to-read,to-read (#303),to-read,,,,0,0
79853,Men To Match My Mountains: The Opening of the Far West 1840-1900,Irving Stone,"Stone, Irving",Lewis Gannett,"=""0785813470""","=""9780785813477""",0,4.12,Castle Books,Hardcover,459,2009,1956,,2024/09/22,to-read,to-read (#294),to-read,,,,0,0
124429,"The Last Mughal: The Fall of a Dynasty: Delhi, 1857",William Dalrymple,"Dalrymple, William",,"=""1400043107""","=""9781400043101""",0,4.19,Alfred A. Knopf,Hardcover,534,2007,2006,,2024/09/22,to-read,to-read (#295),to-read,,,,0,0
691001,Four Queens: The Provençal Sisters Who Ruled Europe,Nancy  Goldstone,"Goldstone, Nancy",,"=""0670038431""","=""9780670038435""",0,3.88,Penguin Books Ltd,Hardcover,336,2007,2007,,2024/09/22,to-read,to-read (#296),to-read,,,,0,0
276214,A History of Private Life: From Pagan Rome to Byzantium,Philippe Ariès,"Ariès, Philippe","Paul Veyne, Georges Duby, Arthur Goldhammer, Yvon Thébert, Michel Rouche, Évelyne Patlagean, Peter Brown","=""0674399749""","=""9780674399747""",0,4.00,Belknap Press/Harvard University Press,Paperback,670,1992,1985,,2024/09/22,to-read,to-read (#295),to-read,,,,0,0
11140803,American Nations: A History of the Eleven Rival Regional Cultures of North America,Colin Woodard,"Woodard, Colin",,"=""0670022969""","=""9780670022960""",0,4.20,Viking,Hardcover,371,2011,2011,,2024/09/22,to-read,to-read (#295),to-read,,,,0,0
1394894,"Nazi Germany and the Jews: The Years of Persecution, 1933-39",Saul. Friedlander,"Friedlander, Saul.",,"=""0297818821""","=""9780297818823""",0,4.14,W&N,Hardcover,432,1997,,,2024/09/22,to-read,to-read (#294),to-read,,,,0,0
7229040,Six Wives: The Queens of Henry VIII,David Starkey,"Starkey, David",,"=""""","=""""",0,4.13,Vintage,Paperback,852,2004,1999,,2024/09/22,to-read,to-read (#291),to-read,,,,0,0
790089,BLOOD IN ZION: How the Jewish Guerrillas Drove the British Out of Palestine,Saul Zadka,"Zadka, Saul",,"=""1857531361""","=""9781857531367""",0,4.08,Brasseys,Hardcover,240,2003,1995,,2024/09/22,to-read,to-read (#288),to-read,,,,0,0
1189973,Lee's Lieutenants: A Study in Command,Douglas Southall Freeman,"Freeman, Douglas Southall",Stephen W. Sears,"=""0684859793""","=""9780684859798""",0,4.21,Simon & Schuster,Paperback,912,2001,1940,,2024/09/22,to-read,to-read (#289),to-read,,,,0,0
101065,"Miracle at Philadelphia: The Story of the Constitutional Convention, May to September 1787",Catherine Drinker Bowen,"Bowen, Catherine Drinker",,"=""0316103985""","=""9780316103985""",0,4.07,Back Bay Books,Paperback,346,1986,1966,,2024/09/22,to-read,to-read (#292),to-read,,,,0,0
471742,Elizabeth's London: Everyday Life in Elizabethan London,Liza Picard,"Picard, Liza",,"=""0312325665""","=""9780312325664""",0,3.98,St. Martin's Griffin,Paperback,368,2005,2003,,2024/09/22,to-read,to-read (#286),to-read,,,,0,0
9587101,The Last Gunfight: The Real Story of the Shootout at the O.K. Corral--And How It Changed The American West,Jeff Guinn,"Guinn, Jeff",,"=""1439154244""","=""9781439154243""",0,3.96,Simon & Schuster,Hardcover,392,2011,2011,,2024/09/22,to-read,to-read (#287),to-read,,,,0,0
10372167,The Time Traveller's Guide to Elizabethan England,Ian Mortimer,"Mortimer, Ian",,"=""1847921140""","=""9781847921147""",0,4.09,Bodley Head,Hardcover,432,2012,2010,,2024/09/22,to-read,to-read (#285),to-read,,,,0,0
12722468,Elizabeth the Queen: The Life of a Modern Monarch,Sally Bedell Smith,"Smith, Sally Bedell",,"=""1400067898""","=""9781400067893""",0,3.87,Random House,Hardcover,663,2012,2012,,2024/09/22,to-read,to-read (#293),to-read,,,,0,0
17262206,"Lawrence in Arabia: War, Deceit, Imperial Folly, and the Making of the Modern Middle East",Scott Anderson,"Anderson, Scott",,"=""038553292X""","=""9780385532921""",0,4.08,Doubleday,Hardcover,577,2013,2013,,2024/09/22,to-read,to-read (#291),to-read,,,,0,0
20588662,"An Indigenous Peoples' History of the United States (ReVisioning American History, #3)",Roxanne Dunbar-Ortiz,"Dunbar-Ortiz, Roxanne",,"=""080700040X""","=""9780807000403""",0,4.37,Beacon Press,Hardcover,320,2014,2014,,2024/09/22,to-read,to-read (#290),to-read,,,,0,0
20821092,Napoleon: A Life,Andrew Roberts,"Roberts, Andrew",,"=""0670025321""","=""9780670025329""",0,4.23,Viking Pr,Paperback,976,2014,2014,,2024/09/22,to-read,to-read (#285),to-read,,,,0,0
144189,Days of The French Revolution,Christopher Hibbert,"Hibbert, Christopher",,"=""0688169783""","=""9780688169787""",0,3.78,Harper Perennial,Paperback,352,2002,1980,,2024/09/22,to-read,to-read (#282),to-read,,,,0,0
10883,Benjamin Franklin: An American Life,Walter Isaacson,"Isaacson, Walter",,"=""074325807X""","=""9780743258074""",0,4.04,Simon & Schuster,Paperback,586,2004,2003,,2024/09/22,to-read,to-read (#284),to-read,,,,0,0
10079,Mary Queen of Scots,Antonia Fraser,"Fraser, Antonia",,"=""038531129X""","=""9780385311298""",0,3.99,Delta,Paperback,568,1993,1969,,2024/09/22,to-read,to-read (#283),to-read,,,,0,0
79929,"The Rising Sun: The Decline & Fall of the Japanese Empire, 1936-45",John  Toland,"Toland, John",,"=""0812968581""","=""9780812968583""",0,4.29,Modern Library,Paperback,976,2003,1970,,2024/09/22,to-read,to-read (#283),to-read,,,,0,0
2393575,Nixonland: The Rise of a President and the Fracturing of America,Rick Perlstein,"Perlstein, Rick",,"=""0743243021""","=""9780743243025""",0,4.24,Scribner,Hardcover,881,2008,2008,,2024/09/22,to-read,to-read (#282),to-read,,,,0,0
55200,The Second World War,John Keegan,"Keegan, John",,"=""014011341X""","=""9780140113419""",0,4.11,Penguin Books,Paperback,608,1990,1990,,2024/09/22,to-read,to-read (#283),to-read,,,,0,0
155239,"A History of Britain: The Wars of the British 1603-1776 (A History of Britain, #2)",Simon Schama,"Schama, Simon",,"=""0786867523""","=""9780786867523""",0,4.02,Miramax,Hardcover,544,2001,2001,,2024/09/22,to-read,to-read (#279),to-read,,,,0,0
287542,The Thirty Years War,C.V. Wedgwood,"Wedgwood, C.V.",Anthony Grafton,"=""1590171462""","=""9781590171462""",0,4.18,NYRB Classics,Paperback,520,2005,1938,,2024/09/22,to-read,to-read (#281),to-read,,,,0,0
148821,Brunelleschi's Dome: How a Renaissance Genius Reinvented Architecture,Ross King,"King, Ross",,"=""0142000159""","=""9780142000151""",0,3.90,Penguin Books,Paperback,192,2001,1999,,2024/09/22,to-read,to-read (#277),to-read,,,,0,0
46725,Plagues and Peoples,William H. McNeill,"McNeill, William H.",,"=""0385121229""","=""9780385121224""",0,3.88,Anchor,Paperback,368,1976,1976,,2024/09/22,to-read,to-read (#280),to-read,,,,0,0
1138543,The Strange Death of Liberal England,George Dangerfield,"Dangerfield, George",,"=""0804729301""","=""9780804729307""",0,4.10,Stanford University Press,Paperback,364,1997,1935,,2024/09/22,to-read,to-read (#280),to-read,,,,0,0
27200,Sailing the Wine-Dark Sea: Why the Greeks Matter (The Hinges of History),Thomas Cahill,"Cahill, Thomas",,"=""0385495544""","=""9780385495547""",0,3.75,Anchor,Paperback,304,2004,2003,,2024/09/22,to-read,to-read (#276),to-read,,,,0,0
2911704,Papillon,Henri Charrière,"Charrière, Henri",,"=""0671785281""","=""9780671785284""",0,4.23,Pocket Books,Mass Market Paperback,458,1971,1969,,2024/09/22,to-read,to-read (#277),to-read,,,,0,0
79356,Pillar of Fire: America in the King Years 1963-65,Taylor Branch,"Branch, Taylor",,"=""0684848090""","=""9780684848099""",0,4.35,Simon & Schuster,Paperback,768,1999,1998,,2024/09/22,to-read,to-read (#277),to-read,,,,0,0
2455549,D-Day: The Battle for Normandy,Antony Beevor,"Beevor, Antony",Illus. with photos,"=""067088703X""","=""9780670887033""",0,4.18,Viking,Hardcover,632,2009,2009,,2024/09/22,to-read,to-read (#280),to-read,,,,0,0
1848,Wild Swans: Three Daughters of China,Jung Chang,"Chang, Jung",,"=""""","=""""",0,4.29,Simon & Schuster,Paperback,562,2003,1991,,2024/09/22,to-read,to-read (#280),to-read,,,,0,0
52042,Ten Days that Shook the World,John   Reed,"Reed, John",,"=""0486452409""","=""9780486452401""",0,3.93,Dover,Paperback,400,2006,1919,,2024/09/22,to-read,to-read (#278),to-read,,,,0,0
3398625,The Lost City of Z: A Tale of Deadly Obsession in the Amazon,David Grann,"Grann, David",,"=""0385513534""","=""9780385513531""",0,3.89,Doubleday/Random House (NY),Hardcover,339,2009,2009,,2024/09/22,to-read,to-read (#276),to-read,,,,0,0
57572,Don't Know Much About History: Everything You Need to Know About American History but Never Learned,Kenneth C. Davis,"Davis, Kenneth C.",,"=""0060083824""","=""9780060083823""",0,3.87,HarperCollins,Paperback,678,2004,1990,,2024/09/22,to-read,to-read (#275),to-read,,,,0,0
333301,The Return of Martin Guerre,Natalie Zemon Davis,"Davis, Natalie Zemon",,"=""0674766911""","=""9780674766914""",0,3.76,Harvard University Press,Paperback,162,1983,1983,,2024/09/22,to-read,to-read (#274),to-read,,,,0,0
795301,"The Great Upheaval: America and the Birth of the Modern World, 1788-1800",Jay Winik,"Winik, Jay",,"=""0060083131""","=""9780060083137""",0,4.07,Harper,Hardcover,690,2007,2007,,2024/09/22,to-read,to-read (#274),to-read,,,,0,0
215758,Shake Hands with the Devil,Roméo Dallaire,"Dallaire, Roméo",Samantha Power,"=""0786715103""","=""9780786715107""",0,4.24,Da Capo Press,Paperback,562,2004,2003,,2024/09/22,to-read,to-read (#275),to-read,,,,0,0
6792458,The New Jim Crow: Mass Incarceration in the Age of Colorblindness,Michelle Alexander,"Alexander, Michelle",,"=""""","=""""",0,4.52,The New Press Inc.,Hardcover,290,2010,2010,,2024/09/22,to-read,to-read (#274),to-read,,,,0,0
17412744,Catastrophe 1914: Europe Goes to War,Max Hastings,"Hastings, Max",,"=""0307597059""","=""9780307597052""",0,4.06,Knopf,Hardcover,628,2013,2013,,2024/09/22,to-read,to-read (#274),to-read,,,,0,0
2367,Brave Companions: Portraits in History,David McCullough,"McCullough, David",,"=""""","=""""",0,4.04,Simon Schuster,Paperback,240,1992,1991,,2024/09/22,to-read,to-read (#268),to-read,,,,0,0
6956,The Radicalism of the American Revolution,Gordon S. Wood,"Wood, Gordon S.",,"=""0679736883""","=""9780679736882""",0,4.08,Vintage,Paperback,447,1993,1992,,2024/09/22,to-read,to-read (#273),to-read,,,,0,0
9051,The Historian's Craft: Reflections on the Nature and Uses of History and the Techniques and Methods of Those Who Write It.,Marc Bloch,"Bloch, Marc","Peter Putnam, Joseph R. Strayer","=""0394705122""","=""9780394705125""",0,4.08,Vintage,Mass Market Paperback,197,1964,1949,,2024/09/22,to-read,to-read (#272),to-read,,,,0,0
22477,The Ideological Origins of the American Revolution,Bernard Bailyn,"Bailyn, Bernard",,"=""0674443020""","=""9780674443020""",0,4.05,Belknap Press of Harvard University Press,Paperback,416,1992,1967,,2024/09/22,to-read,to-read (#270),to-read,,,,0,0
97484,The Strange Career of Jim Crow,C. Vann Woodward,"Woodward, C. Vann",William S. McFeely,"=""0195146905""","=""9780195146905""",0,4.14,Oxford University Press,Paperback,245,2002,1955,,2024/09/22,to-read,to-read (#271),to-read,,,,0,0
158620,The Wars of the Roses,Alison Weir,"Weir, Alison",,"=""0345404335""","=""9780345404336""",0,3.99,Ballantine Books,Paperback,463,1996,1995,,2024/09/22,to-read,to-read (#271),to-read,,,,0,0
132913,Reconstruction: America's Unfinished Revolution 1863-1877,Eric Foner,"Foner, Eric","Richard B. Morris, Henry Steele Commager","=""0060937165""","=""9780060937164""",0,4.20,Harper Perennial Modern Classics,Paperback,690,2002,1988,,2024/09/22,to-read,to-read (#268),to-read,,,,0,0
156459,"John Paul Jones: Sailor, Hero, Father of the American Navy",Evan Thomas,"Thomas, Evan",,"=""0743258045""","=""9780743258043""",0,4.01,Simon & Schuster,Paperback,400,2004,2003,,2024/09/22,to-read,to-read (#267),to-read,,,,0,0
415634,Plutarch's Lives: Volume I,Plutarch,"Plutarch, Plutarch","John Dryden, James Atlas, Arthur Hugh Clough","=""0375756760""","=""9780375756764""",0,4.10,Modern Library,Paperback,766,2001,100,,2024/09/22,to-read,to-read (#269),to-read,,,,0,0
401514,Alive: The Story of the Andes Survivors,Piers Paul Read,"Read, Piers Paul",,"=""038000321X""","=""9780380003211""",0,4.13,Avon,Paperback,318,1975,1974,,2024/09/22,to-read,to-read (#272),to-read,,,,0,0
745364,Almost a Miracle: The American Victory in the War of Independence,John Ferling,"Ferling, John",,"=""0195181212""","=""9780195181210""",0,4.19,Oxford University Press,Hardcover,704,2007,2007,,2024/09/22,to-read,to-read (#269),to-read,,,,0,0
7170627,The Emperor of All Maladies: A Biography of Cancer,Siddhartha Mukherjee,"Mukherjee, Siddhartha",,"=""""","=""""",0,4.34,Scribner,Hardcover,571,2010,2010,,2024/09/22,to-read,to-read (#268),to-read,,,,0,0
71984,"Ghost Wars: The Secret History of the CIA, Afghanistan, and Bin Laden from the Soviet Invasion to September 10, 2001",Steve Coll,"Coll, Steve",,"=""0143034669""","=""9780143034667""",0,4.31,Penguin Books (London),Paperback,712,2004,2004,,2024/09/22,to-read,to-read (#265),to-read,,,,0,0
239356,Huey Long,T. Harry Williams,"Williams, T. Harry",,"=""0394747909""","=""9780394747903""",0,4.23,Vintage,Paperback,944,1981,1969,,2024/09/22,to-read,to-read (#266),to-read,,,,0,0
774198,"The Age of Empire, 1875–1914",Eric J. Hobsbawm,"Hobsbawm, Eric J.",,"=""0679721754""","=""9780679721758""",0,4.25,Vintage Books,Paperback,405,1989,1987,,2024/09/22,to-read,to-read (#264),to-read,,,,0,0
20821029,The Wars of the Roses: The Fall of the Plantagenets and the Rise of the Tudors,Dan Jones,"Jones, Dan",,"=""0670026670""","=""9780670026678""",0,4.27,Viking,Hardcover,392,2014,2014,,2024/09/22,to-read,to-read (#263),to-read,,,,0,0
416407,MICHAEL COLLINS: The Man Who Made Ireland,Tim Pat Coogan,"Coogan, Tim Pat",,"=""0312295111""","=""9780312295110""",0,4.07,Griffin,Paperback,533,2002,1990,,2024/09/22,to-read,to-read (#254),to-read,,,,0,0
84370,The Last Battle: The Classic History of the Battle for Berlin,Cornelius Ryan,"Ryan, Cornelius",,"=""0684803291""","=""9780684803296""",0,4.24,Simon & Schuster,Paperback,571,1995,1966,,2024/09/22,to-read,to-read (#257),to-read,,,,0,0
64533,The Crusades Through Arab Eyes,Amin Maalouf,"Maalouf, Amin",,"=""0805208984""","=""9780805208986""",0,4.20,Schocken,Paperback,293,1989,1983,,2024/09/22,to-read,to-read (#261),to-read,,,,0,0
2714607,The Ascent of Money: A Financial History of the World,Niall Ferguson,"Ferguson, Niall",,"=""1594201927""","=""9781594201929""",0,3.90,Penguin Press,Hardcover,442,2008,2007,,2024/09/22,to-read,to-read (#255),to-read,,,,0,0
55139,"The Year 1000: What Life Was Like at the Turn of the First Millennium, An Englishman's World",Robert Lacey,"Lacey, Robert",,"=""0316511579""","=""9780316511575""",0,3.87,Back Bay Books,Paperback,230,2000,1998,,2024/09/22,to-read,to-read (#256),to-read,,,,0,0
13533740,Thomas Jefferson: The Art of Power,Jon Meacham,"Meacham, Jon",,"=""1400067669""","=""9781400067664""",0,4.04,Random House,Hardcover,759,2012,2012,,2024/09/22,to-read,to-read (#258),to-read,,,,0,0
17568801,Zealot: The Life and Times of Jesus of Nazareth,Reza Aslan,"Aslan, Reza",,"=""140006922X""","=""9781400069224""",0,3.86,Random House,Hardcover,296,2013,2013,,2024/09/22,to-read,to-read (#262),to-read,,,,0,0
18763135,"The Triumph of Improvisation: Gorbachev's Adaptability, Reagan's Engagement, and the End of the Cold War",James Graham Wilson,"Wilson, James Graham",,"=""0801452295""","=""9780801452291""",0,3.61,Cornell University Press,Hardcover,280,2014,2014,,2024/09/22,to-read,to-read (#260),to-read,,,,0,0
55692678,"Understanding China: Learning from China's Past, Present, and Future",Stefan Piech,"Piech, Stefan",,"=""""","=""""",0,3.88,,Paperback,,2020,,,2024/09/22,to-read,to-read (#259),to-read,,,,0,0
43365,"American Slavery, American Freedom",Edmund S. Morgan,"Morgan, Edmund S.",,"=""039332494X""","=""9780393324945""",0,4.13,W. W. Norton & Company,Paperback,464,2003,1975,,2024/09/22,to-read,to-read (#252),to-read,,,,0,0
75243,Nature's Metropolis: Chicago and the Great West,William Cronon,"Cronon, William",,"=""0393308731""","=""9780393308730""",0,4.25,W. W. Norton & Company,Paperback,592,1992,1991,,2024/09/22,to-read,to-read (#251),to-read,,,,0,0
108780,The Penguin History of New Zealand,Michael King,"King, Michael",,"=""0143018671""","=""9780143018674""",0,4.14,Penguin Books,Paperback,570,2003,2003,,2024/09/22,to-read,to-read (#250),to-read,,,,0,0
903778,The Waning of the Middle Ages,Johan Huizinga,"Huizinga, Johan",,"=""0486404439""","=""9780486404431""",0,4.03,Dover Publications,Paperback,352,2013,1919,,2024/09/22,to-read,to-read (#247),to-read,,,,0,0
106591,Lincoln's Melancholy: How Depression Challenged a President and Fueled His Greatness,Joshua Wolf Shenk,"Shenk, Joshua Wolf",,"=""0618773444""","=""9780618773442""",0,3.92,HarperOne,Paperback,368,2006,2005,,2024/09/22,to-read,to-read (#246),to-read,,,,0,0
19807,The Glory and the Dream: A Narrative History of America 1932-72,William Manchester,"Manchester, William",,"=""0553345893""","=""9780553345896""",0,4.43,"Little, Brown & Company (Boston/Toronto)",Hardcover,1408,1984,1974,,2024/09/22,to-read,to-read (#249),to-read,,,,0,0
9553383,A History of the World in 100 Objects,Neil MacGregor,"MacGregor, Neil",,"=""1846144132""","=""9781846144134""",0,4.20,Allen Lane,Hardcover,707,2010,2010,,2024/09/22,to-read,to-read (#248),to-read,,,,0,0
13454654,Return of a King: The Battle for Afghanistan,William Dalrymple,"Dalrymple, William",,"=""1408818302""","=""9781408818305""",0,4.34,Bloomsbury Publishing ,Hardcover,608,2013,2013,,2024/09/22,to-read,to-read (#253),to-read,,,,0,0
95224,The Colony: The Harrowing True Story Of The Exiles Of Molokai,John Tayman,"Tayman, John",,"=""0743233018""","=""9780743233019""",0,3.80,Scribner,Paperback,421,2007,2006,,2024/09/22,to-read,to-read (#239),to-read,,,,0,0
100352,Life in a Medieval City (Medieval Life),Joseph Gies,"Gies, Joseph",Frances Gies,"=""0060908807""","=""9780060908805""",0,3.83,Harper & Row,Paperback,274,1981,1969,,2024/09/22,to-read,to-read (#242),to-read,,,,0,0
20949,American Caesar: Douglas MacArthur 1880-1964,William Manchester,"Manchester, William",,"=""0316544981""","=""9780316544986""",0,4.08,"Little, Brown & Company (Boston/Toronto)",Hardcover,811,1978,1978,,2024/09/22,to-read,to-read (#240),to-read,,,,0,0
356824,India After Gandhi: The History of the World's Largest Democracy,Ramachandra Guha,"Guha, Ramachandra",,"=""0060198818""","=""9780060198817""",0,4.39,Ecco,Hardcover,912,2007,2007,,2024/09/22,to-read,to-read (#244),to-read,,,,0,0
579111,In Europe: Travels Through the Twentieth Century,Geert Mak,"Mak, Geert",,"=""1843432269""","=""9781843432265""",0,4.35,Harvill Secker,Hardcover,752,2007,2004,,2024/09/22,to-read,to-read (#239),to-read,,,,0,0
742882,Grant,Jean Edward Smith,"Smith, Jean Edward",,"=""0684849275""","=""9780684849270""",0,4.03,Simon & Schuster,Paperback,784,2002,2001,,2024/09/22,to-read,to-read (#243),to-read,,,,0,0
17252,"Crucible of War: The Seven Years' War and the Fate of Empire in British North America, 1754 - 1766",Fred  Anderson,"Anderson, Fred",,"=""0375706364""","=""9780375706363""",0,4.19,Vintage,Paperback,912,2001,2000,,2024/09/22,to-read,to-read (#241),to-read,,,,0,0
80369,Discipline and Punish: The Birth of the Prison,Michel Foucault,"Foucault, Michel",Alan Sheridan,"=""0679752552""","=""9780679752554""",0,4.23,Vintage,Paperback,333,1995,1975,,2024/09/22,to-read,to-read (#244),to-read,,,,0,0
28493187,Als die Soldaten kamen: Die Vergewaltigung deutscher Frauen am Ende des Zweiten Weltkriegs,Miriam Gebhardt,"Gebhardt, Miriam",,"=""""","=""""",0,4.30, DVA Dt.Verlags,Hardcover,352,2015,2015,,2024/09/22,to-read,to-read (#245),to-read,,,,0,0
202146,Flyboys,James D. Bradley,"Bradley, James D.",,"=""0316159433""","=""9780316159432""",0,4.19,Back Bay Books,Paperback,464,2004,2003,,2024/09/22,to-read,to-read (#238),to-read,,,,0,0
49255,Nothing Like It in the World: The Men Who Built the Transcontinental Railroad 1863-69,Stephen E. Ambrose,"Ambrose, Stephen E.",,"=""0743203178""","=""9780743203173""",0,3.98,Simon & Schuster (NYC),Paperback,432,2001,2000,,2024/09/22,to-read,to-read (#234),to-read,,,,0,0
174722,"Our Oriental Heritage (The Story of Civilization, #1)",Will Durant,"Durant, Will",,"=""1567310125""","=""9781567310122""",0,4.30,Fine,Hardcover,1047,1993,1935,,2024/09/22,to-read,to-read (#234),to-read,,,,0,0
308059,"The Age of Capital, 1848–1875",Eric J. Hobsbawm,"Hobsbawm, Eric J.",,"=""0679772545""","=""9780679772545""",0,4.25,Vintage Books,Paperback,354,1996,1975,,2024/09/22,to-read,to-read (#235),to-read,,,,0,0
