Book Id,Title,Author,Author l-f,Additional Authors,ISBN,ISBN13,My Rating,Average Rating,Publisher,Binding,Number of Pages,Year Published,Original Publication Year,Date Read,Date Added,Bookshelves,Bookshelves with positions,Exclusive Shelf,My Review,Spoiler,Private Notes,Read Count,Owned Copies
32081,"Albion's Seed: Four British Folkways in America (America: A Cultural History, Vol. I)",David Hackett Fischer,"Fischer, David Hackett",,"=""0195069056""","=""9780195069051""",0,4.37,Oxford University Press,Paperback,946,1989,1989,,2024/09/22,to-read,to-read (#131),to-read,,,,0,0
308060,"The Age of Extremes, 1914-1991",Eric J. Hobsbawm,"Hobsbawm, Eric J.",,"=""0679730052""","=""9780679730057""",0,4.28,Vintage Books,Paperback,627,1996,1994,,2024/09/22,to-read,to-read (#128),to-read,,,,0,0
28212,"And the Band Played On: Politics, People, and the AIDS Epidemic",Randy Shilts,"Shilts, Randy",William Greider,"=""0312241356""","=""9780312241353""",0,4.38,Stonewall Inn Editions,Paperback,660,2000,1987,,2024/09/22,to-read,to-read (#130),to-read,,,,0,0
4424,"An Unfinished Life: John F. Kennedy, 1917-1963",Robert Dallek,"Dallek, Robert",,"=""0316907928""","=""9780316907927""",0,3.99,Back Bay Books,Paperback,849,2004,2011,,2024/09/22,to-read,to-read (#129),to-read,,,,0,0
109487,Blood and Thunder: An Epic of the American West,Hampton Sides,"Sides, Hampton",,"=""0385507771""","=""9780385507776""",0,4.28,Doubleday,Hardcover,460,2006,2006,,2024/09/22,to-read,to-read (#127),to-read,,,,0,0
891922,A Stillness at Appomattox,Bruce Catton,"Catton, Bruce",,"=""0385044518""","=""9780385044516""",0,4.37,Anchor Books,Paperback,438,1990,1951,,2024/09/22,to-read,to-read (#126),to-read,,,,0,0
9862761,1493: Uncovering the New World Columbus Created,Charles C. Mann,"Mann, Charles C.",,"=""0307265722""","=""9780307265722""",0,4.12,Alfred A. Knopf (NY),Hardcover,557,2011,2011,,2024/09/22,to-read,to-read (#125),to-read,,,,0,0
239186,"Isaac's Storm: A Man, a Time, and the Deadliest Hurricane in History",Erik Larson,"Larson, Erik",,"=""0375708278""","=""9780375708275""",0,4.05,Vintage Books USA,Paperback,323,2000,1999,,2024/09/22,to-read,to-read (#124),to-read,,,,0,0
19802,A World Lit Only by Fire: The Medieval Mind and the Renaissance: Portrait of an Age,William Manchester,"Manchester, William",,"=""0316545562""","=""9780316545563""",0,3.83,"Little, Brown and Company",Paperback,322,1993,1992,,2024/09/22,to-read,to-read (#116),to-read,,,,0,0
18478222,Twelve Years a Slave,Solomon Northup,"Northup, Solomon","Karolyn Smardz Frost, Sue Eakin, Joseph Logsdon, Eric Ashley Hairston","=""""","=""9780989794800""",0,4.22,Eakin Films & Publishing,ebook,363,2013,1853,,2024/09/22,to-read,to-read (#123),to-read,,,,0,0
171362,"The Mediterranean and the Mediterranean World in the Age of Philip II, Volume I",Fernand Braudel,"Braudel, Fernand",,"=""0520203089""","=""9780520203082""",0,4.32,University of California Press,Paperback,642,1996,1949,,2024/09/22,to-read,to-read (#121),to-read,,,,0,0
78508,The River of Doubt: Theodore Roosevelt's Darkest Journey,Candice Millard,"Millard, Candice",,"=""0767913736""","=""9780767913737""",0,4.20,Anchor,Paperback,416,2006,2005,,2024/09/22,to-read,to-read (#120),to-read,,,,0,0
2371,The Johnstown Flood,David McCullough,"McCullough, David",,"=""0844662925""","=""9780844662923""",0,4.13,Peter Smith Publisher,Hardcover,302,1987,1968,,2024/09/22,to-read,to-read (#118),to-read,,,,0,0
25017,"Krakatoa: The Day the World Exploded: August 27, 1883",Simon Winchester,"Winchester, Simon",,"=""0060838590""","=""9780060838591""",0,3.88,Harper Perennial,Paperback,416,2005,2003,,2024/09/22,to-read,to-read (#122),to-read,,,,0,0
10534,The Art of War,Sun Tzu,"Tzu, Sun",Thomas Cleary,"=""""","=""""",0,3.95,Harper Press,Paperback,170,2005,-400,,2024/09/22,to-read,to-read (#124),to-read,,,,0,0
8890989,Churchill's Secret War: The British Empire and the Ravaging of India During World War II,Madhusree Mukerjee,"Mukerjee, Madhusree",,"=""046502260X""","=""9780465022601""",0,4.18,Basic Books,Kindle Edition,0,2010,2008,,2024/09/22,to-read,to-read (#119),to-read,,,,0,0
28789711,SPQR: A History of Ancient Rome,Mary Beard,"Beard, Mary",,"=""1631492225""","=""9781631492228""",0,4.06,Liveright,Paperback,606,2016,2015,,2024/09/22,to-read,to-read (#117),to-read,,,,0,0
60432,Caesar: Life of a Colossus,Adrian Goldsworthy,"Goldsworthy, Adrian",,"=""0300120486""","=""9780300120486""",0,4.22,Yale University Press,Hardcover,583,2006,2006,,2024/09/22,to-read,to-read (#113),to-read,,,,0,0
174354,Over the Edge of the World: Magellan's Terrifying Circumnavigation of the Globe,Laurence Bergreen,"Bergreen, Laurence",,"=""006093638X""","=""9780060936389""",0,4.17,Perennial / HarperCollins,Paperback,438,2004,2003,,2024/09/22,to-read,to-read (#109),to-read,,,,0,0
319300,Georgiana: Duchess of Devonshire,Amanda Foreman,"Foreman, Amanda",,"=""0375753834""","=""9780375753831""",0,3.77,Modern Library,Paperback,456,2001,1998,,2024/09/22,to-read,to-read (#111),to-read,,,,0,0
826564,Young Stalin,Simon Sebag Montefiore,"Montefiore, Simon Sebag",,"=""0297850687""","=""9780297850687""",0,3.96,Weidenfeld & Nicolson,Hardcover,397,2007,2007,,2024/09/22,to-read,to-read (#110),to-read,,,,0,0
10847,Under the Banner of Heaven: A Story of Violent Faith,Jon Krakauer,"Krakauer, Jon",,"=""0330419129""","=""9780330419123""",0,4.01,Pan MacMillan,Paperback,400,2004,2003,,2024/09/22,to-read,to-read (#115),to-read,,,,0,0
448135,The Coldest Winter: America and the Korean War,David Halberstam,"Halberstam, David",,"=""1401300529""","=""9781401300524""",0,4.21,Hyperion,Hardcover,734,2007,2007,,2024/09/22,to-read,to-read (#112),to-read,,,,0,0
110890,The Looming Tower: Al-Qaeda and the Road to 9/11,Lawrence Wright,"Wright, Lawrence",,"=""037541486X""","=""9780375414862""",0,4.35,Knopf,Hardcover,469,2006,2006,,2024/09/22,to-read,to-read (#108),to-read,,,,0,0
3761596,"The Third Reich at War (The History of the Third Reich, #3)",Richard J. Evans,"Evans, Richard J.",,"=""1594202060""","=""9781594202063""",0,4.38,Penguin,Hardcover,926,2009,,,2024/09/22,to-read,to-read (#114),to-read,,,,0,0
92057,The Autobiography of Malcolm X,Malcolm X,"X, Malcolm",Alex Haley,"=""""","=""""",0,4.36,Ballantine Books,Mass Market Paperback,466,2015,1965,,2024/09/22,to-read,to-read (#104),to-read,,,,0,0
418937,"The Stripping of the Altars: Traditional Religion in England, 1400-1580",Eamon Duffy,"Duffy, Eamon",,"=""0300108281""","=""9780300108286""",0,4.25,Yale University Press,Paperback,700,2005,1992,,2024/09/22,to-read,to-read (#102),to-read,,,,0,0
1111,The Power Broker: Robert Moses and the Fall of New York,Robert A. Caro,"Caro, Robert A.",,"=""0394720245""","=""9780394720241""",0,4.48,Vintage Books,Paperback,1246,1975,1974,,2024/09/22,to-read,to-read (#100),to-read,,,,0,0
536788,"The Third Reich in Power (The History of the Third Reich, #2)",Richard J. Evans,"Evans, Richard J.",,"=""1594200742""","=""9781594200748""",0,4.34,The Penguin Press,Hardcover,941,2005,2005,,2024/09/22,to-read,to-read (#106),to-read,,,,0,0
234633,"Stilwell and the American Experience in China, 1911-45",Barbara W. Tuchman,"Tuchman, Barbara W.",John King Fairbank,"=""0802138527""","=""9780802138521""",0,4.15,Grove Press,Hardcover,624,2001,1971,,2024/09/22,to-read,to-read (#102),to-read,,,,0,0
1394522,A Bridge Too Far (Coronet Books),Cornelius Ryan,"Ryan, Cornelius",,"=""0340199415""","=""9780340199411""",0,4.27,Coronet Books,Paperback,576,1975,1974,,2024/09/22,to-read,to-read (#107),to-read,,,,0,0
354038,The Last Days of the Incas,Kim MacQuarrie,"MacQuarrie, Kim",,"=""074326049X""","=""9780743260497""",0,4.19,Simon & Schuster,Hardcover,522,2007,2007,,2024/09/22,to-read,to-read (#105),to-read,,,,0,0
6178648,Nothing to Envy: Ordinary Lives in North Korea,Barbara Demick,"Demick, Barbara",,"=""0385523904""","=""9780385523905""",0,4.45,Spiegel & Grau,Hardcover,316,2009,2009,,2024/09/22,to-read,to-read (#103),to-read,,,,0,0
6493208,The Immortal Life of Henrietta Lacks,Rebecca Skloot,"Skloot, Rebecca",,"=""1400052173""","=""9781400052172""",0,4.12,Crown Publishing Group,Hardcover,370,2010,2010,,2024/09/22,to-read,to-read (#107),to-read,,,,0,0
111222,The Life of Elizabeth I,Alison Weir,"Weir, Alison",,"=""0345425502""","=""9780345425508""",0,4.03,Ballantine Books,Paperback,532,1999,1998,,2024/09/22,to-read,to-read (#101),to-read,,,,0,0
613792,The Zimmermann Telegram,Barbara W. Tuchman,"Tuchman, Barbara W.",,"=""""","=""""",0,4.06,Random House Trade Paperbacks,Paperback,244,1985,1958,,2024/09/22,to-read,to-read (#97),to-read,,,,0,0
10104,The Six Wives of Henry VIII,Alison Weir,"Weir, Alison",,"=""0802136834""","=""9780802136831""",0,4.11,Grove Press,Paperback,643,1992,1992,,2024/09/22,to-read,to-read (#94),to-read,,,,0,0
36086,"The Ghost Map: The Story of London's Most Terrifying Epidemic—and How It Changed Science, Cities, and the Modern World",Steven Johnson,"Johnson, Steven",,"=""1594489254""","=""9781594489259""",0,3.89,Riverhead Hardcover,Hardcover,299,2006,2006,,2024/09/22,to-read,to-read (#98),to-read,,,,0,0
527523,Citizens: A Chronicle of the French Revolution,Simon Schama,"Schama, Simon",,"=""0679726101""","=""9780679726104""",0,4.01,"Random House, Inc. (NYC)",Paperback,948,1990,1989,,2024/09/22,to-read,to-read (#98),to-read,,,,0,0
270032,Seven Years in Tibet,Heinrich Harrer,"Harrer, Heinrich",,"=""0874778883""","=""9780874778885""",0,4.10,Tarcher,Paperback,330,1996,1953,,2024/09/22,to-read,to-read (#94),to-read,,,,0,0
22680,American Sphinx: The Character of Thomas Jefferson,Joseph J. Ellis,"Ellis, Joseph J.",,"=""0679764410""","=""9780679764410""",0,3.94,Vintage Books,Paperback,440,1998,1997,,2024/09/22,to-read,to-read (#95),to-read,,,,0,0
96123,All the President’s Men,Carl Bernstein,"Bernstein, Carl",Bob Woodward,"=""1416522913""","=""9781416522911""",0,4.18,Pocket Books,Paperback,480,2005,1974,,2024/09/22,to-read,to-read (#96),to-read,,,,0,0
3004197,The Blood Never Dried: A People's History of the British Empire,John Newsinger,"Newsinger, John",,"=""1905192126""","=""9781905192120""",0,4.24,Bookmarks Publications,Paperback,256,2006,2006,,2024/09/22,to-read,to-read (#97),to-read,,,,0,0
7507825,At Home: A Short History of Private Life,Bill Bryson,"Bryson, Bill",,"=""0767919386""","=""9780767919388""",0,3.99,Doubleday,Hardcover,497,2010,2010,,2024/09/22,to-read,to-read (#93),to-read,,,,0,0
7311907,"The Last Stand: Custer, Sitting Bull, and the Battle of the Little Bighorn",Nathaniel Philbrick,"Philbrick, Nathaniel",,"=""0670021725""","=""9780670021727""",0,4.04,Viking,Hardcover,466,2010,2010,,2024/09/22,to-read,to-read (#99),to-read,,,,0,0
9938498,"In the Garden of Beasts: Love, Terror, and an American Family in Hitler's Berlin",Erik Larson,"Larson, Erik",,"=""0307408841""","=""9780307408846""",0,3.88,Crown,Hardcover,448,2011,2011,,2024/09/22,to-read,to-read (#93),to-read,,,,0,0
22551730,Dead Wake: The Last Crossing of the Lusitania,Erik Larson,"Larson, Erik",,"=""0307408868""","=""9780307408860""",0,4.12,Crown Publishers,Hardcover,430,2015,2015,,2024/09/22,to-read,to-read (#95),to-read,,,,0,0
103749,Persian Fire: The First World Empire and the Battle for the West,Tom Holland,"Holland, Tom",,"=""0385513119""","=""9780385513111""",0,4.16,DoubleDay,Hardcover,418,2006,2005,,2024/09/22,to-read,to-read (#92),to-read,,,,0,0
15594,"A Midwife's Tale: The Life of Martha Ballard, Based on Her Diary, 1785-1812",Laurel Thatcher Ulrich,"Ulrich, Laurel Thatcher",,"=""0679733760""","=""9780679733768""",0,3.96,Vintage Books,Paperback,444,1991,1990,,2024/09/22,to-read,to-read (#92),to-read,,,,0,0
106590,Lincoln,David Herbert Donald,"Donald, David Herbert",,"=""068482535X""","=""9780684825359""",0,4.19,Simon  Schuster,Paperback,714,1996,1995,,2024/09/22,to-read,to-read (#89),to-read,,,,0,0
448718,The Annals of Imperial Rome,Tacitus,"Tacitus, Tacitus",Michael    Grant,"=""""","=""""",0,3.98,Penguin Classics,Paperback,447,1956,116,,2024/09/22,to-read,to-read (#89),to-read,,,,0,0
55751,"The Last Lion: Winston Spencer Churchill: Alone, 1932-40",William Manchester,"Manchester, William",,"=""0385313314""","=""9780385313315""",0,4.38,Bantam,Paperback,800,1989,1988,,2024/09/22,to-read,to-read (#90),to-read,,,,0,0
6514074,"The Monuments Men: Allied Heroes, Nazi Thieves, and the Greatest Treasure Hunt in History",Robert M. Edsel,"Edsel, Robert M.",Bret Witter,"=""1599951495""","=""9781599951492""",0,3.80,Center Street,Hardcover,473,2009,2009,,2024/09/22,to-read,to-read (#91),to-read,,,,0,0
2369,The Great Bridge: The Epic Story of the Building of the Brooklyn Bridge,David McCullough,"McCullough, David",,"=""0743217373""","=""9780743217378""",0,4.25,Simon & Schuster,Hardcover,608,2001,1972,,2024/09/22,to-read,to-read (#87),to-read,,,,0,0
29658,Postwar: A History of Europe Since 1945,Tony Judt,"Judt, Tony",,"=""0143037757""","=""9780143037750""",0,4.37,Penguin Books,Paperback,933,2006,2005,,2024/09/22,to-read,to-read (#86),to-read,,,,0,0
8155672,"The German Genius: Europe's Third Renaissance, the Second Scientific Revolution, and the Twentieth Century",Peter Watson,"Watson, Peter",,"=""0060760222""","=""9780060760229""",0,4.18,Harper,Hardcover,992,2010,2010,,2024/09/22,to-read,to-read (#85),to-read,,,,0,0
64719,Hitler: 1936-1945 Nemesis,Ian Kershaw,"Kershaw, Ian",,"=""0393322521""","=""9780393322521""",0,4.37,W.W. Norton & Company,Paperback,1115,2001,1998,,2024/09/22,to-read,to-read (#88),to-read,,,,0,0
86525,Master of the Senate,Robert A. Caro,"Caro, Robert A.",,"=""0394720954""","=""9780394720951""",0,4.41,Vintage,Paperback,1167,2003,2002,,2024/09/22,to-read,to-read (#79),to-read,,,,0,0
86524,The Path to Power,Robert A. Caro,"Caro, Robert A.",,"=""0679729453""","=""9780679729457""",0,4.40,Vintage,Paperback,882,1990,1982,,2024/09/22,to-read,to-read (#78),to-read,,,,0,0
3559,From Beirut to Jerusalem,Thomas L. Friedman,"Friedman, Thomas L.",,"=""0385413726""","=""9780385413725""",0,4.14,Anchor,Paperback,541,1995,1989,,2024/09/22,to-read,to-read (#84),to-read,,,,0,0
49250,"D-Day, June 6, 1944: The Battle for the Normandy Beaches",stephen-e-ambrose,"stephen-e-ambrose, stephen-e-ambrose",,"=""0743449746""","=""9780743449748""",0,4.31,Simon & Schuster,Paperback,656,2002,1994,,2024/09/22,to-read,to-read (#76),to-read,,,,0,0
45000,The Island at the Center of the World: The Epic Story of Dutch Manhattan and the Forgotten Colony That Shaped America,Russell Shorto,"Shorto, Russell",,"=""1400078679""","=""9781400078677""",0,4.16,Vintage,Paperback,384,2005,2004,,2024/09/22,to-read,to-read (#81),to-read,,,,0,0
970488,Legacy of Ashes: The History of the CIA,Tim Weiner,"Weiner, Tim",,"=""038551445X""","=""9780385514453""",0,3.94,Doubleday,Hardcover,514,2007,2007,,2024/09/22,to-read,to-read (#83),to-read,,,,0,0
225947,The History of the Ancient World: From the Earliest Accounts to the Fall of Rome,Susan Wise Bauer,"Bauer, Susan Wise",,"=""039305974X""","=""9780393059748""",0,4.11,W. W. Norton & Company ,Hardcover,896,2007,2001,,2024/09/22,to-read,to-read (#82),to-read,,,,0,0
18669169,The Sleepwalkers: How Europe Went to War in 1914,Christopher   Clark,"Clark, Christopher",,"=""""","=""""",0,4.21,Penguin,Kindle Edition,682,2012,2012,,2024/09/22,to-read,to-read (#80),to-read,,,,0,0
22609391,The Wright Brothers,David McCullough,"McCullough, David",,"=""""","=""""",0,4.17,Simon & Schuster,Hardcover,320,2015,2015,,2024/09/22,to-read,to-read (#77),to-read,,,,0,0
42512,We Were Soldiers Once... and Young: Ia Drang - The Battle that Changed the War in Vietnam,Harold G. Moore,"Moore, Harold G.",Joseph L. Galloway,"=""034547581X""","=""9780345475817""",0,4.33,Presidio Press,Paperback,480,2004,1991,,2024/09/22,to-read,to-read (#67),to-read,,,,0,0
55229,April 1865: The Month That Saved America,Jay Winik,"Winik, Jay",,"=""0060899689""","=""9780060899684""",0,4.16,Harper Perennial,Paperback,512,2006,2001,,2024/09/22,to-read,to-read (#73),to-read,,,,0,0
2368,Mornings on Horseback,David McCullough,"McCullough, David",,"=""0671447548""","=""9780671447540""",0,4.09,Simon & Schuster,Paperback,445,1982,1981,,2024/09/22,to-read,to-read (#68),to-read,,,,0,0
169354,"The Prize: The Epic Quest for Oil, Money, and Power",Daniel Yergin,"Yergin, Daniel",,"=""0671799320""","=""9780671799328""",0,4.43,Free Press,Paperback,928,1993,1991,,2024/09/22,to-read,to-read (#71),to-read,,,,0,0
770512,1066: The Year of the Conquest,David Howarth,"Howarth, David",,"=""""","=""""",0,4.06,Penguin Books,Paperback,208,1981,1977,,2024/09/22,to-read,to-read (#74),to-read,,,,0,0
78107,A Peace to End All Peace: The Fall of the Ottoman Empire and The Creation of the Modern Middle East,David Fromkin,"Fromkin, David",,"=""0805068848""","=""9780805068849""",0,4.21,Owl Books,Paperback,635,2001,1989,,2024/09/22,to-read,to-read (#75),to-read,,,,0,0
55403,Black Hawk Down: A Story of Modern War,Mark Bowden,"Bowden, Mark",,"=""0871137380""","=""9780871137388""",0,4.30,Atlantic Monthly Press,Hardcover,386,1999,1999,,2024/09/22,to-read,to-read (#66),to-read,,,,0,0
541920,"An Army at Dawn: The War in North Africa, 1942-1943 (World War II Liberation Trilogy, #1)",Rick Atkinson,"Atkinson, Rick",,"=""0805062882""","=""9780805062885""",0,4.29,Henry Holt and Co.,Hardcover,681,2002,2002,,2024/09/22,to-read,to-read (#69),to-read,,,,0,0
17157,Marie Antoinette: The Journey,Antonia Fraser,"Fraser, Antonia",,"=""0307277747""","=""9780307277749""",0,3.93,Anchor,Paperback,512,2006,2001,,2024/09/22,to-read,to-read (#70),to-read,,,,0,0
7968243,Cleopatra: A Life,Stacy Schiff,"Schiff, Stacy",,"=""0316001929""","=""9780316001922""",0,3.73,"Little, Brown and Company",Hardcover,369,2010,2010,,2024/09/22,to-read,to-read (#67),to-read,,,,0,0
8255917,Washington: A Life,Ron Chernow,"Chernow, Ron",,"=""1594202664""","=""9781594202667""",0,4.16,Penguin Press,Hardcover,904,2010,2010,,2024/09/22,to-read,to-read (#72),to-read,,,,0,0
6462,His Excellency: George Washington,Joseph J. Ellis,"Ellis, Joseph J.",,"=""1400032539""","=""9781400032532""",0,3.95,Vintage,Paperback,320,2005,2004,,2024/09/22,to-read,to-read (#61),to-read,,,,0,0
93996,Hitler: 1889-1936 Hubris,Ian Kershaw,"Kershaw, Ian",,"=""0393320359""","=""9780393320350""",0,4.15,W.W. Norton & Company,Paperback,912,2000,1998,,2024/09/22,to-read,to-read (#63),to-read,,,,0,0
10302,The March Of Folly: From Troy To Vietnam,Barbara W. Tuchman,"Tuchman, Barbara W.",,"=""0345308239""","=""9780345308238""",0,4.02,Random House,Paperback,447,1993,1984,,2024/09/22,to-read,to-read (#64),to-read,,,,0,0
38155,"A People's Tragedy: The Russian Revolution, 1891 - 1924",Orlando Figes,"Figes, Orlando",,"=""014024364X""","=""9780140243642""",0,4.36,Penguin Books,Paperback,923,1998,1996,,2024/09/22,to-read,to-read (#60),to-read,,,,0,0
61834,A Night to Remember,Walter Lord,"Lord, Walter",Nathaniel Philbrick,"=""0805077642""","=""9780805077643""",0,4.09,St Martin's Griffin,Paperback,182,2005,1955,,2024/09/22,to-read,to-read (#62),to-read,,,,0,0
7493,Founding Brothers: The Revolutionary Generation,Joseph J. Ellis,"Ellis, Joseph J.",,"=""0375705244""","=""9780375705243""",0,3.95,Vintage Books,Unknown Binding,288,2000,2000,,2024/09/22,to-read,to-read (#58),to-read,,,,0,0
1206073,Washington's Crossing,David Hackett Fischer,"Fischer, David Hackett",,"=""0195170342""","=""9780195170344""",0,4.15,Oxford University Press,Hardcover,564,2004,2003,,2024/09/22,to-read,to-read (#65),to-read,,,,0,0
19809,"The Last Lion: Winston Spencer Churchill: Visions of Glory, 1874-1932",William Manchester,"Manchester, William",,"=""0385313489""","=""9780385313483""",0,4.33,Bantam,Paperback,992,1984,1983,,2024/09/22,to-read,to-read (#59),to-read,,,,0,0
2715,Salt: A World History,Mark Kurlansky,"Kurlansky, Mark",,"=""0142001619""","=""9780142001615""",0,3.75,Penguin Books,Paperback,484,2003,2002,,2024/09/22,to-read,to-read (#52),to-read,,,,0,0
42661,The Fall of Berlin 1945,Antony Beevor,"Beevor, Antony",Ole Steen Hansen,"=""""","=""""",0,4.29,Penguin Books,Paperback,490,2003,2002,,2024/09/22,to-read,to-read (#49),to-read,,,,0,0
110331,The Federalist Papers,Alexander Hamilton,"Hamilton, Alexander","James Madison, John Jay, Robert G. Scigliano, Charles R. Kessler, Clinton L. Rossiter, United States, Publius","=""""","=""""",0,4.10,Signet Classics,Paperback,688,2003,1788,,2024/09/22,to-read,to-read (#50),to-read,,,,0,0
18728,No Ordinary Time: Franklin and Eleanor Roosevelt: The Home Front in World War II,Doris Kearns Goodwin,"Goodwin, Doris Kearns",,"=""0684804484""","=""9780684804484""",0,4.20,Simon & Schuster,Paperback,633,1995,1994,,2024/09/22,to-read,to-read (#51),to-read,,,,0,0
2372,"The Path Between the Seas: The Creation of the Panama Canal, 1870-1914",David McCullough,"McCullough, David",,"=""0743262131""","=""9780743262132""",0,4.22,Simon & Schuster,Hardcover,698,2004,1977,,2024/09/22,to-read,to-read (#57),to-read,,,,0,0
319473,"The Coming of the Third Reich (The History of the Third Reich, #1)",Richard J. Evans,"Evans, Richard J.",,"=""0143034693""","=""9780143034698""",0,4.28,Penguin Books,Paperback,622,2005,2003,,2024/09/22,to-read,to-read (#54),to-read,,,,0,0
161156,The Longest Day,Cornelius Ryan,"Ryan, Cornelius",Jouko Linturi,"=""""","=""""",0,4.33,Simon  Schuster,Paperback,350,1994,1959,,2024/09/22,to-read,to-read (#55),to-read,,,,0,0
40631,Europe: A History,Norman Davies,"Davies, Norman",,"=""0060974680""","=""9780060974688""",0,4.20,Harper Perennial,Paperback,1392,1998,1996,,2024/09/22,to-read,to-read (#56),to-read,,,,0,0
6572270,Bloodlands: Europe Between Hitler and Stalin,Timothy Snyder,"Snyder, Timothy",,"=""0465002390""","=""9780465002399""",0,4.38,Basic Books,Hardcover,524,2010,2010,,2024/09/22,to-read,to-read (#53),to-read,,,,0,0
36236161,Tesla: Inventor of the Modern,Richard Munson,"Munson, Richard",,"=""0393635449""","=""9780393635447""",0,3.78,W. W. Norton & Company,Hardcover,320,2018,2018,,2024/09/22,to-read,to-read (#56),to-read,,,,0,0
91017,Rubicon: The Last Years of the Roman Republic,Tom Holland,"Holland, Tom",,"=""1400078970""","=""9781400078974""",0,4.22,Anchor Books,Paperback,408,2005,2003,,2024/09/22,to-read,to-read (#45),to-read,,,,0,0
16884,The Making of the Atomic Bomb,Richard Rhodes,"Rhodes, Richard",,"=""0684813785""","=""9780684813783""",0,4.39,Simon & Schuster,Paperback,886,1995,1986,,2024/09/22,to-read,to-read (#47),to-read,,,,0,0
49251,Citizen Soldiers: The US Army from the Normandy Beaches to the Bulge to the Surrender of Germany,Stephen E. Ambrose,"Ambrose, Stephen E.",,"=""0684848015""","=""9780684848013""",0,4.24,Simon & Schuster,Paperback,528,1998,1997,,2024/09/22,to-read,to-read (#46),to-read,,,,0,0
771332,With the Old Breed: At Peleliu and Okinawa,Eugene B. Sledge,"Sledge, Eugene B.",Paul Fussell,"=""0195067142""","=""9780195067149""",0,4.47,Oxford University Press,Paperback,326,1990,1981,,2024/09/22,to-read,to-read (#41),to-read,,,,0,0
10884,Einstein: His Life and Universe,Walter Isaacson,"Isaacson, Walter",,"=""0743264738""","=""9780743264730""",0,4.16,Simon & Schuster,Hardcover,675,2007,2007,,2024/09/22,to-read,to-read (#48),to-read,,,,0,0
4806,Longitude: The True Story of a Lone Genius Who Solved the Greatest Scientific Problem of His Time,Dava Sobel,"Sobel, Dava",Neil Armstrong,"=""0802714625""","=""9780802714626""",0,3.98,Walker Books,Hardcover,184,2005,1995,,2024/09/22,to-read,to-read (#44),to-read,,,,0,0
25669,How the Irish Saved Civilization: The Untold Story of Ireland's Heroic Role from the Fall of Rome to the Rise of Medieval Europe ,Thomas Cahill,"Cahill, Thomas",,"=""0385418493""","=""9780385418492""",0,3.81,Bantam Doubleday Dell (NYC),Paperback,246,1996,1995,,2024/09/22,to-read,to-read (#42),to-read,,,,0,0
10335318,"Destiny of the Republic: A Tale of Madness, Medicine and the Murder of a President",Candice Millard,"Millard, Candice",,"=""0385526261""","=""9780385526265""",0,4.21,Doubleday,Hardcover,339,2011,2011,,2024/09/22,to-read,to-read (#43),to-read,,,,0,0
296662,Lies My Teacher Told Me: Everything Your American History Textbook Got Wrong,James W. Loewen,"Loewen, James W.",,"=""0684818868""","=""9780684818863""",0,3.97,"Touchstone Books/Simon & Schuster, Inc.",Paperback,383,1996,1995,,2024/09/22,to-read,to-read (#37),to-read,,,,0,0
146274,Manhunt: The 12-Day Chase for Lincoln's Killer,James L. Swanson,"Swanson, James L.",,"=""0060518502""","=""9780060518509""",0,4.16,William Morrow Paperbacks,Paperback,444,2007,2006,,2024/09/22,to-read,to-read (#41),to-read,,,,0,0
40923,Theodore Rex,Edmund Morris,"Morris, Edmund",,"=""0812966007""","=""9780812966008""",0,4.18,Random House Trade Paperbacks,Paperback,772,2002,2001,,2024/09/22,to-read,to-read (#36),to-read,,,,0,0
29022,The Twelve Caesars,Suetonius,"Suetonius, Suetonius","Michael    Grant, Robert Graves","=""0140449213""","=""9780140449211""",0,4.01,Penguin Classics,Paperback,363,2003,121,,2024/09/22,to-read,to-read (#35),to-read,,,,0,0
475,Collapse: How Societies Choose to Fail or Succeed,Jared Diamond,"Diamond, Jared",,"=""0143036556""","=""9780143036555""",0,3.93,Penguin Books Ltd. (London),Paperback,608,2005,2004,,2024/09/22,to-read,to-read (#40),to-read,,,,0,0
94799,Ghost Soldiers: The Epic Account of World War II's Greatest Rescue Mission,Hampton Sides,"Sides, Hampton",,"=""038549565X""","=""9780385495653""",0,4.24,Vintage,Paperback,344,2002,2001,,2024/09/22,to-read,to-read (#39),to-read,,,,0,0
25019,"The Professor and the Madman: A Tale of Murder, Insanity and the Making of the Oxford English Dictionary",Simon Winchester,"Winchester, Simon",,"=""0060839783""","=""9780060839789""",0,3.84,Harper Perennial,Paperback,242,2005,1998,,2024/09/22,to-read,to-read (#40),to-read,,,,0,0
192955,"The Proud Tower: A Portrait of the World Before the War, 1890-1914",Barbara W. Tuchman,"Tuchman, Barbara W.",,"=""0345405013""","=""9780345405012""",0,4.13,Ballantine Books,Paperback,588,1996,1965,,2024/09/22,to-read,to-read (#35),to-read,,,,0,0
