Book Id,Title,Author,Author l-f,Additional Authors,ISBN,ISBN13,My Rating,Average Rating,Publisher,Binding,Number of Pages,Year Published,Original Publication Year,Date Read,Date Added,Bookshelves,Bookshelves with positions,Exclusive Shelf,My Review,Spoiler,Private Notes,Read Count,Owned Copies
75060,Jarhead : A Marine's Chronicle of the Gulf War and Other Battles,Anthony Swofford,"Swofford, Anthony",,"=""0743287215""","=""9780743287210""",0,3.69,Scribner,Paperback,260,2005,2003,,2024/09/22,to-read,to-read (#392),to-read,,,,0,0
657623,The Isles: A History,Norman Davies,"Davies, Norman",,"=""0195148312""","=""9780195148312""",0,4.00,Oxford University Press,Paperback,1296,2001,1999,,2024/09/22,to-read,to-read (#391),to-read,,,,0,0
1191303,Saratoga: Turning Point of America's Revolutionary War,Richard M. Ketchum,"Ketchum, Richard M.",,"=""0805061231""","=""9780805061239""",0,4.15,Holt Paperbacks,Paperback,576,1999,1997,,2024/09/22,to-read,to-read (#388),to-read,,,,0,0
773961,The American Political Tradition and the Men Who Made It,Richard Hofstadter,"Hofstadter, Richard",,"=""0679723153""","=""9780679723158""",0,4.04,"Random House, Inc.",Paperback,560,1973,1948,,2024/09/22,to-read,to-read (#388),to-read,,,,0,0
2898564,Tried by War: Abraham Lincoln as Commander in Chief,James M. McPherson,"McPherson, James M.",,"=""1594201919""","=""9781594201912""",0,4.09,The Penguin Press,Hardcover,329,2008,2008,,2024/09/22,to-read,to-read (#387),to-read,,,,0,0
4839382,The First Tycoon: The Epic Life of Cornelius Vanderbilt,T.J. Stiles,"Stiles, T.J.",,"=""0375415424""","=""9780375415425""",0,3.89,Knopf,Hardcover,736,2009,2009,,2024/09/22,to-read,to-read (#391),to-read,,,,0,0
10767816,Ghost on the Throne: The Death of Alexander the Great and the War for Crown and Empire,James Romm,"Romm, James",,"=""0307271641""","=""9780307271648""",0,4.28,Alfred A. Knopf,Hardcover,341,2011,2011,,2024/09/22,to-read,to-read (#390),to-read,,,,0,0
13425592,"Devil in the Grove: Thurgood Marshall, the Groveland Boys, and the Dawn of a New America",Gilbert King,"King, Gilbert",,"=""0062097717""","=""9780062097712""",0,4.40,Harper,ebook,434,2012,2012,,2024/09/22,to-read,to-read (#390),to-read,,,,0,0
33864676,Red Famine: Stalin's War on Ukraine,Anne Applebaum,"Applebaum, Anne",,"=""0771009305""","=""9780771009303""",0,4.39,Signal,Hardcover,496,2017,2017,,2024/09/22,to-read,to-read (#388),to-read,,,,0,0
435556,Enemy at the Gates: The Battle for Stalingrad,William Craig,"Craig, William",,"=""076074677X""","=""9780760746776""",0,4.23,Barnes & Noble Books,Hardcover,457,2003,1973,,2024/09/22,to-read,to-read (#385),to-read,,,,0,0
159210,How the Scots Invented the Modern World: The True Story of How Western Europe’s Poorest Nation Created our World & Everything in It,Arthur Herman,"Herman, Arthur",,"=""0609809997""","=""9780609809990""",0,3.93,Random House,Paperback,480,2002,2001,,2024/09/22,to-read,to-read (#385),to-read,,,,0,0
198834,The Rise of Western Christendom: Triumph & Diversity 200–1000,Peter Brown,"Brown, Peter",,"=""0631221387""","=""9780631221388""",0,4.17,Wiley-Blackwell,Paperback,712,2003,1995,,2024/09/22,to-read,to-read (#385),to-read,,,,0,0
240485,Storm of Steel,Ernst Jünger,"Jünger, Ernst",,"=""0141186917""","=""9780141186917""",0,4.14,Penguin Books,Paperback,289,2004,1920,,2024/09/22,to-read,to-read (#386),to-read,,,,0,0
21412350,The Bully Pulpit: Theodore Roosevelt and the Golden Age of Journalism,Doris Kearns Goodwin,"Goodwin, Doris Kearns",,"=""1416547878""","=""9781416547877""",0,4.14,Simon & Schuster,Paperback,912,2013,2013,,2024/09/22,to-read,to-read (#385),to-read,,,,0,0
58725003,Spare Parts: The Story of Medicine Through the History of Transplant Surgery,Paul Craddock,"Craddock, Paul",,"=""125028032X""","=""9781250280329""",0,3.88,St. Martin's Press,Hardcover,320,2022,2021,,2024/09/22,to-read,to-read (#385),to-read,,,,0,0
3419805,The Forgotten Man: A New History of the Great Depression,Amity Shlaes,"Shlaes, Amity",,"=""0060936428""","=""9780060936426""",0,3.91,Harper Perennial,Paperback,568,2008,2007,,2024/09/22,to-read,to-read (#378),to-read,,,,0,0
177187,102 Minutes: The Untold Story of the Fight to Survive Inside the Twin Towers,Jim Dwyer,"Dwyer, Jim",Kevin Flynn,"=""0805080325""","=""9780805080322""",0,4.29,Times Books,Paperback,384,2006,2005,,2024/09/22,to-read,to-read (#382),to-read,,,,0,0
306822,"Aristocrats: Caroline, Emily, Louisa, and Sarah Lennox, 1740-1832",Stella Tillyard,"Tillyard, Stella",,"=""0374524475""","=""9780374524470""",0,4.10,The Noonday Press,Paperback,412,1995,1994,,2024/09/22,to-read,to-read (#377),to-read,,,,0,0
27512,The Final Days,Bob Woodward,"Woodward, Bob",Carl Bernstein,"=""""","=""""",0,4.16,Simon & Schuster,Paperback,480,2005,1976,,2024/09/22,to-read,to-read (#377),to-read,,,,0,0
59651,Hard Times: An Oral History of the Great Depression,Studs Terkel,"Terkel, Studs",,"=""1565846567""","=""9781565846562""",0,4.19,The New Press,Paperback,462,2005,1970,,2024/09/22,to-read,to-read (#381),to-read,,,,0,0
1932185,The Rise of the West: A History of the Human Community,William H. McNeill,"McNeill, William H.",Béla Petheö,"=""0226561445""","=""9780226561448""",0,4.12,University of Chicago Press,Paperback,828,1970,1963,,2024/09/22,to-read,to-read (#383),to-read,,,,0,0
978045,Everyday Stalinism: Ordinary Life in Extraordinary Times: Soviet Russia in the 1930s,Sheila Fitzpatrick,"Fitzpatrick, Sheila",,"=""0195050002""","=""9780195050004""",0,3.91,Oxford University Press,Hardcover,288,1999,1999,,2024/09/22,to-read,to-read (#384),to-read,,,,0,0
2774104,"Conquistador: Hernán Cortés, King Montezuma, and the Last Stand of the Aztecs",Buddy Levy,"Levy, Buddy",,"=""055380538X""","=""9780553805383""",0,4.27,Bantam Books,Hardcover,448,2008,2008,,2024/09/22,to-read,to-read (#382),to-read,,,,0,0
7324357,Last Call: The Rise and Fall of Prohibition,Daniel Okrent,"Okrent, Daniel",,"=""0743277023""","=""9780743277020""",0,3.89,Scribner,Hardcover,480,2010,2010,,2024/09/22,to-read,to-read (#378),to-read,,,,0,0
17736477,Vegas and the Mob,Al W. Moe,"Moe, Al W.",,"=""1483955559""","=""9781483955551""",0,3.66,CreateSpace,Paperback,188,2013,2013,,2024/09/22,to-read,to-read (#380),to-read,,,,0,0
38488145,Origins Of India: Bharatvarsham,Ravi   Pathak,"Pathak, Ravi",,"=""""","=""""",0,4.54,,Kindle Edition,161,2018,,,2024/09/22,to-read,to-read (#379),to-read,,,,0,0
56186392,Chains Across the River - A Novel of the American Revolution,Bevis Longstreth,"Longstreth, Bevis",,"=""0578750511""","=""9780578750514""",0,4.28,Honeycomb Publishers,ebook,,2021,,,2024/09/22,to-read,to-read (#384),to-read,,,,0,0
531,A War Like No Other: How the Athenians & Spartans Fought the Peloponnesian War,Victor Davis Hanson,"Hanson, Victor Davis",,"=""0812969707""","=""9780812969702""",0,4.13,Random House,Paperback,416,2006,2005,,2024/09/22,to-read,to-read (#371),to-read,,,,0,0
33057,"Cathedral, Forge, and Waterwheel: Technology and Invention in the Middle Ages",Frances Gies,"Gies, Frances",Joseph Gies,"=""0060925817""","=""9780060925819""",0,3.88,Harper Perennial,Paperback,357,1995,1994,,2024/09/22,to-read,to-read (#375),to-read,,,,0,0
49253,Crazy Horse and Custer,Stephen E. Ambrose,"Ambrose, Stephen E.",,"=""0743468643""","=""9780743468640""",0,4.22,Pocket Books,Paperback,560,2003,1975,,2024/09/22,to-read,to-read (#373),to-read,,,,0,0
93959,Hirohito and the Making of Modern Japan,Herbert P. Bix,"Bix, Herbert P.",,"=""0060931302""","=""9780060931308""",0,3.85,Harper Perennial,Paperback,832,2001,2000,,2024/09/22,to-read,to-read (#376),to-read,,,,0,0
10097,Queen of Scots: The True Life of Mary Stuart,John Guy,"Guy, John",,"=""0618254110""","=""9780618254118""",0,3.94,Houghton Mifflin Harcourt,Hardcover,560,2004,2004,,2024/09/22,to-read,to-read (#372),to-read,,,,0,0
573022,The Third Reich: A New History,Michael Burleigh,"Burleigh, Michael",,"=""080909326X""","=""9780809093267""",0,4.10,Hill and Wang,Paperback,992,2001,2000,,2024/09/22,to-read,to-read (#375),to-read,,,,0,0
326883,"Their Finest Hour (The Second World War, #2)",Winston S. Churchill,"Churchill, Winston S.",,"=""0141441739""","=""9780141441733""",0,4.40,"Mariner Books;  Reissue edition (May 9, 1986)",Paperback,720,1986,1986,,2024/09/22,to-read,to-read (#375),to-read,,,,0,0
681647,The American Heritage Picture History of the Civil War,Bruce Catton,"Catton, Bruce",,"=""0517385562""","=""9780517385562""",0,4.36,Gramercy,Hardcover,630,1994,1960,,2024/09/22,to-read,to-read (#374),to-read,,,,0,0
149748,Trespassers on the Roof of the World: The Secret Exploration of Tibet (Kodansha Globe),Peter Hopkirk,"Hopkirk, Peter",,"=""1568360509""","=""9781568360508""",0,4.19,Kodansha Globe,Paperback,286,1995,1982,,2024/09/22,to-read,to-read (#370),to-read,,,,0,0
197169,Only Yesterday: An Informal History of the 1920's,Frederick Lewis Allen,"Allen, Frederick Lewis",,"=""0060956658""","=""9780060956653""",0,3.97,Harper Perennial Modern Classics,Paperback,352,2010,1931,,2024/09/22,to-read,to-read (#370),to-read,,,,0,0
647492,Ordinary Men: Reserve Police Battalion 101 and the Final Solution in Poland,Christopher R. Browning,"Browning, Christopher R.",,"=""0060995068""","=""9780060995065""",0,4.11,Harper Perennial,Paperback,271,1998,1992,,2024/09/22,to-read,to-read (#366),to-read,,,,0,0
681617,Landscape Turned Red: The Battle of Antietam,Stephen W. Sears,"Sears, Stephen W.",,"=""0618344195""","=""9780618344192""",0,4.23,Mariner Books,Paperback,464,2003,1983,,2024/09/22,to-read,to-read (#366),to-read,,,,0,0
10295345,The Long Walk: The True Story of a Trek to Freedom,Slavomir Rawicz,"Rawicz, Slavomir",,"=""""","=""""",0,4.24,,Kindle Edition,277,,1956,,2024/09/22,to-read,to-read (#367),to-read,,,,0,0
531176,The Bookseller of Kabul,Åsne Seierstad,"Seierstad, Åsne",,"=""0316734500""","=""9780316734509""",0,3.77,"Little, Brown and Company",Hardcover,288,2003,2002,,2024/09/22,to-read,to-read (#369),to-read,,,,0,0
11199114,Kon-Tiki: Across the Pacific by Raft,Thor Heyerdahl,"Heyerdahl, Thor",,"=""""","=""""",0,4.16,Skyhorse Publishing,Kindle Edition,308,2010,1948,,2024/09/22,to-read,to-read (#370),to-read,,,,0,0
101425,Andrew Jackson: His Life and Times,H.W. Brands,"Brands, H.W.",,"=""1400030722""","=""9781400030729""",0,3.93,Anchor,Paperback,656,2006,2005,,2024/09/22,to-read,to-read (#365),to-read,,,,0,0
2030180,"Trail of Hope: The Story of the Mormon Trail, Companion to the PBS Documentary",William W. Slaughter,"Slaughter, William W.",Michael Landon,"=""1573452513""","=""9781573452519""",0,4.25,Shadow Mountain,Hardcover,204,1997,1997,,2024/09/22,to-read,to-read (#368),to-read,,,,0,0
15770926,Bloody British History: Plymouth,Laura Quigley,"Quigley, Laura",,"=""0752466380""","=""9780752466385""",0,4.31,The History Press,Paperback,96,2012,2012,,2024/09/22,to-read,to-read (#365),to-read,,,,0,0
196717,American Creation: Triumphs and Tragedies at the Founding of the Republic,Joseph J. Ellis,"Ellis, Joseph J.",,"=""030726369X""","=""9780307263698""",0,3.96,Alfred A. Knopf/Random House (NY/Toronto),Hardcover,283,2007,2007,,2024/09/22,to-read,to-read (#361),to-read,,,,0,0
287426,Alexander the Great,Robin Lane Fox,"Fox, Robin Lane",,"=""0141020768""","=""9780141020761""",0,4.09,Fisicalbook,Paperback,576,2016,1973,,2024/09/22,to-read,to-read (#362),to-read,,,,0,0
340312,"Liberty's Daughters: The Revolutionary Experience of American Women, 1750-1800",Mary Beth Norton,"Norton, Mary Beth",,"=""0801483476""","=""9780801483479""",0,3.88,Cornell University Press,Paperback,408,1996,1996,,2024/09/22,to-read,to-read (#364),to-read,,,,0,0
2285076,In Flanders Fields: Passchendaele 1917,Leon Wolff,"Wolff, Leon",,"=""0141390794""","=""9780141390796""",0,3.99,Penguin Uk,Paperback,310,2001,1958,,2024/09/22,to-read,to-read (#363),to-read,,,,0,0
6533039,After the Prophet: The Epic Story of the Shia-Sunni Split in Islam,Lesley Hazleton,"Hazleton, Lesley",,"=""0385523939""","=""9780385523936""",0,4.09,Doubleday,Hardcover,256,2009,2009,,2024/09/22,to-read,to-read (#361),to-read,,,,0,0
33917107,On Tyranny: Twenty Lessons from the Twentieth Century,Timothy Snyder,"Snyder, Timothy",,"=""0804190119""","=""9780804190114""",0,4.19,Tim Duggan Books,Paperback,126,2017,2017,,2024/09/22,to-read,to-read (#360),to-read,,,,0,0
35068612,The Rise and Fall of the Dinosaurs: A New History of a Lost World,Steve Brusatte,"Brusatte, Steve",,"=""0062490451""","=""9780062490452""",0,4.20,William Morrow,ebook,416,2018,2018,,2024/09/22,to-read,to-read (#362),to-read,,,,0,0
4999,"Iron Kingdom: The Rise and Downfall of Prussia, 1600–1947",Christopher   Clark,"Clark, Christopher",,"=""0674023854""","=""9780674023857""",0,4.16,Belknap Press,Hardcover,776,2006,2006,,2024/09/22,to-read,to-read (#359),to-read,,,,0,0
58479,The Americanization of Benjamin Franklin,Gordon S. Wood,"Wood, Gordon S.",,"=""0143035282""","=""9780143035282""",0,4.13,Penguin Publishing Group,Paperback,320,2005,2004,,2024/09/22,to-read,to-read (#353),to-read,,,,0,0
595069,Into Africa: The Epic Adventures of Stanley & Livingstone,Martin Dugard,"Dugard, Martin",,"=""0767910745""","=""9780767910743""",0,4.14,Broadway Books,Paperback,368,2004,2002,,2024/09/22,to-read,to-read (#354),to-read,,,,0,0
166434,Empire: How Britain Made the Modern World,Niall Ferguson,"Ferguson, Niall",,"=""0141007540""","=""9780141007540""",0,3.93,Penguin Books,Paperback,422,2004,2003,,2024/09/22,to-read,to-read (#352),to-read,,,,0,0
935364,Britain BC: Life in Britain and Ireland Before the Romans,Francis Pryor,"Pryor, Francis",,"=""000712693X""","=""9780007126934""",0,4.10,Harper Perennial,Paperback,544,2006,2003,,2024/09/22,to-read,to-read (#356),to-read,,,,0,0
6025160,Lords of Finance: The Bankers Who Broke the World,Liaquat Ahamed,"Ahamed, Liaquat",,"=""159420182X""","=""9781594201820""",0,4.03,Penguin Press,Hardcover,564,2009,2009,,2024/09/22,to-read,to-read (#359),to-read,,,,0,0
8753495,The Fiery Trial: Abraham Lincoln and American Slavery,Eric Foner,"Foner, Eric",,"=""0393066185""","=""9780393066180""",0,4.18,W. W. Norton & Company,Hardcover,448,2010,2010,,2024/09/22,to-read,to-read (#358),to-read,,,,0,0
11544706,Gorbachev-The Rise and Fall of a Hero,I.D. Oppenhiem,"Oppenhiem, I.D.",Ian  Davies,"=""""","=""""",0,3.36,Strawberry Hightower Media,Kindle Edition,60,2011,1991,,2024/09/22,to-read,to-read (#354),to-read,,,,0,0
13330922,"The Black Count: Glory, Revolution, Betrayal, and the Real Count of Monte Cristo",Tom Reiss,"Reiss, Tom",,"=""030738246X""","=""9780307382467""",0,4.01,Crown,Hardcover,414,2012,2012,,2024/09/22,to-read,to-read (#355),to-read,,,,0,0
34184307,Code Girls: The Untold Story of the American Women Code Breakers Who Helped Win World War II,Liza Mundy,"Mundy, Liza",,"=""0316439894""","=""9780316439893""",0,3.97,Hachette Books,Hardcover,640,2017,2017,,2024/09/22,to-read,to-read (#357),to-read,,,,0,0
58999198,"Bad Mexicans: Race, Empire, and Revolution in the Borderlands",Kelly Lytle Hernández,"Hernández, Kelly Lytle",,"=""1324004371""","=""9781324004370""",0,4.19,W. W. Norton & Company,Hardcover,384,2022,2022,,2024/09/22,to-read,to-read (#351),to-read,,,,0,0
1650529,"The Glorious Cause: The American Revolution, 1763-1789 (Oxford History of the United States)",Robert Middlekauff,"Middlekauff, Robert",,"=""0195029216""","=""9780195029215""",0,3.93,Oxford University Press,Hardcover,720,1982,1982,,2024/09/22,to-read,to-read (#344),to-read,,,,0,0
145374,The Gunpowder Plot: Terror and Faith in 1605,Antonia Fraser,"Fraser, Antonia",,"=""0753814013""","=""9780753814017""",0,3.87,W&N,Paperback,448,2002,1996,,2024/09/22,to-read,to-read (#350),to-read,,,,0,0
398884,The Age of Gold: The California Gold Rush and the New American Dream (Search and Recover),H.W. Brands,"Brands, H.W.",,"=""0385720882""","=""9780385720885""",0,4.05,Anchor,Paperback,592,2003,2002,,2024/09/22,to-read,to-read (#349),to-read,,,,0,0
104039,From the Holy Mountain: A Journey Among the Christians of the Middle East,William Dalrymple,"Dalrymple, William",,"=""0805061770""","=""9780805061772""",0,4.31,Holt Paperbacks,Paperback,512,1999,1997,,2024/09/22,to-read,to-read (#348),to-read,,,,0,0
209889,"Dreadnought: Britain, Germany, and the Coming of the Great War",Robert K. Massie,"Massie, Robert K.",,"=""0345375564""","=""9780345375568""",0,4.31,Ballantine Books,Paperback,1040,1992,1991,,2024/09/22,to-read,to-read (#347),to-read,,,,0,0
101323,What Is History?,Edward Hallett Carr,"Carr, Edward Hallett",,"=""039470391X""","=""9780394703916""",0,3.94,Vintage Books,Mass Market Paperback,209,1967,1961,,2024/09/22,to-read,to-read (#347),to-read,,,,0,0
18646,"Galileo's Daughter: A Historical Memoir of Science, Faith and Love",Dava Sobel,"Sobel, Dava",,"=""0140280553""","=""9780140280555""",0,3.75,Penguin Books (NYC),Paperback,420,2000,1999,,2024/09/22,to-read,to-read (#345),to-read,,,,0,0
3980321,The Sisters Who Would Be Queen,Leanda de Lisle,"Lisle, Leanda de",,"=""0007219059""","=""9780007219056""",0,3.90,HarperPress,Hardcover,400,2009,2009,,2024/09/22,to-read,to-read (#348),to-read,,,,0,0
41012533,Fear: Trump in the White House,Bob Woodward,"Woodward, Bob",,"=""1501175513""","=""9781501175510""",0,3.87,Simon & Schuster,Hardcover,448,2018,2018,,2024/09/22,to-read,to-read (#346),to-read,,,,0,0
19085,"Aristotle's Children: How Christians, Muslims, and Jews Rediscovered Ancient Wisdom and Illuminated the Middle Ages",Richard E. Rubenstein,"Rubenstein, Richard E.",,"=""0156030098""","=""9780156030090""",0,4.00,HarperOne,Paperback,384,2004,2003,,2024/09/22,to-read,to-read (#339),to-read,,,,0,0
7748,Fear and Loathing on the Campaign Trail '72,Hunter S. Thompson,"Thompson, Hunter S.",,"=""0446698229""","=""9780446698221""",0,4.13,Grand Central Publishing,Paperback,481,2006,1973,,2024/09/22,to-read,to-read (#339),to-read,,,,0,0
17149,Love and Louis XIV: The Women in the Life of the Sun King,Antonia Fraser,"Fraser, Antonia",,"=""0385509847""","=""9780385509848""",0,3.87,Nan A. Talese,Hardcover,388,2006,2006,,2024/09/22,to-read,to-read (#342),to-read,,,,0,0
9809762,Empires of the Word: A Language History of the World,Nicholas Ostler,"Ostler, Nicholas",,"=""000736489X""","=""9780007364893""",0,4.06,Harper Perennial,Kindle Edition,643,2010,2005,,2024/09/22,to-read,to-read (#343),to-read,,,,0,0
733560,Dr. Johnson's London,Liza Picard,"Picard, Liza",,"=""0312276656""","=""9780312276652""",0,4.04,St. Martin's Press,Hardcover,362,2001,2000,,2024/09/22,to-read,to-read (#341),to-read,,,,0,0
184356,History of the Russian Revolution,Leon Trotsky,"Trotsky, Leon","Ahmed Shawki, Max Eastman","=""1931859450""","=""9781931859455""",0,4.18,Haymarket Books,Paperback,1040,2008,1931,,2024/09/22,to-read,to-read (#341),to-read,,,,0,0
7093,Never Call Retreat,Bruce Catton,"Catton, Bruce",E.B. Long,"=""1842122916""","=""9781842122914""",0,4.37,Phoenix,Paperback,558,2001,1965,,2024/09/22,to-read,to-read (#343),to-read,,,,0,0
6484128,The History of the Medieval World: From the Conversion of Constantine to the First Crusade,Susan Wise Bauer,"Bauer, Susan Wise",,"=""0393059758""","=""9780393059755""",0,4.11,W. W. Norton & Company,Hardcover,746,2010,2010,,2024/09/22,to-read,to-read (#340),to-read,,,,0,0
123957806,Our History Has Always Been Contraband: In Defense of Black Studies,Colin Kaepernick,"Kaepernick, Colin","Robin D.G. Kelley, Keeanga-Yamahtta Taylor","=""""","=""9798888900574""",0,4.44,Haymarket Books,Paperback,191,2023,,,2024/09/22,to-read,to-read (#341),to-read,,,,0,0
154128,Glimpses of World History,Jawaharlal Nehru,"Nehru, Jawaharlal",,"=""0143031058""","=""9780143031055""",0,4.32,Penguin India,Paperback,1193,2004,1934,,2024/09/22,to-read,to-read (#336),to-read,,,,0,0
499712,Katherine Swynford: The Story of John of Gaunt and His Scandalous Duchess,Alison Weir,"Weir, Alison",,"=""0224063219""","=""9780224063210""",0,3.85,Jonathan Cape,Hardcover,288,2007,2009,,2024/09/22,to-read,to-read (#336),to-read,,,,0,0
36622725,Walls: A History of Civilization in Blood and Brick,David  Frye,"Frye, David",,"=""1501172700""","=""9781501172700""",0,3.81,Scribner,Hardcover,304,2018,2018,,2024/09/22,to-read,to-read (#338),to-read,,,,0,0
53293947,Manifesto of the Free People's Union,Jakub Lasak,"Lasak, Jakub",,"=""""","=""""",0,4.48,,Kindle Edition,51,2020,,,2024/09/22,to-read,to-read (#337),to-read,,,,0,0
60784692,The Wounded World: W. E. B. Du Bois and the First World War,Chad L. Williams,"Williams, Chad L.",,"=""0374293155""","=""9780374293154""",0,4.28,"Farrar, Straus and Giroux",Hardcover,544,2023,,,2024/09/22,to-read,to-read (#336),to-read,,,,0,0
62585957,Black Folk: The Roots of the Black Working Class,Blair  L.M. Kelley,"Kelley, Blair L.M.",,"=""1631496557""","=""9781631496554""",0,4.48,Liveright,Hardcover,352,2023,2023,,2024/09/22,to-read,to-read (#338),to-read,,,,0,0
417640,A Bright Shining Lie: John Paul Vann and America in Vietnam,Neil Sheehan,"Sheehan, Neil",,"=""0679724141""","=""9780679724148""",0,4.24,Vintage,Paperback,896,1989,1988,,2024/09/22,to-read,to-read (#333),to-read,,,,0,0
840043,The Rise and Fall of the Great Powers: Economic Change and Military Conflict from 1500 to 2000,Paul Kennedy,"Kennedy, Paul",,"=""0679720197""","=""9780679720195""",0,4.13,Vintage Books,Paperback,677,1989,1987,,2024/09/22,to-read,to-read (#334),to-read,,,,0,0
15195,The Complete Maus,Art Spiegelman,"Spiegelman, Art",,"=""0141014083""","=""9780141014081""",0,4.58,Penguin Books,Paperback,296,2003,1980,,2024/09/22,to-read,to-read (#335),to-read,,,,0,0
29386,Nathaniel's Nutmeg: How One Man's Courage Changed the Course of History,Giles Milton,"Milton, Giles",,"=""0340696761""","=""9780340696767""",0,3.83,Sceptre,Paperback,388,2005,1999,,2024/09/22,to-read,to-read (#329),to-read,,,,0,0
55302,Intellectuals: From Marx and Tolstoy to Sartre and Chomsky,Paul  Johnson,"Johnson, Paul",,"=""1842120395""","=""9781842120392""",0,3.86,Harper Perennial,Paperback,416,2007,1988,,2024/09/22,to-read,to-read (#326),to-read,,,,0,0
132917,"A Short History of Reconstruction, 1863-1877",Eric Foner,"Foner, Eric",,"=""0060964316""","=""9780060964313""",0,4.03,Perennial,Paperback,297,1990,1990,,2024/09/22,to-read,to-read (#327),to-read,,,,0,0
17994,The Code Book: The Science of Secrecy from Ancient Egypt to Quantum Cryptography,Simon Singh,"Singh, Simon",,"=""0385495323""","=""9780385495325""",0,4.30,Anchor,Paperback,432,2000,1999,,2024/09/22,to-read,to-read (#325),to-read,,,,0,0
184654,"The Prophet Armed: Trotsky, 1879-1921",Isaac Deutscher,"Deutscher, Isaac",,"=""1859844413""","=""9781859844410""",0,4.34,Verso,Paperback,497,2003,1954,,2024/09/22,to-read,to-read (#332),to-read,,,,0,0
4531763,Champlain's Dream,David Hackett Fischer,"Fischer, David Hackett",,"=""1416593322""","=""9781416593324""",0,4.28,Simon & Schuster,Hardcover,834,2008,2008,,2024/09/22,to-read,to-read (#331),to-read,,,,0,0
7624086,"Hellhound on His Trail: The Stalking of Martin Luther King, Jr. and the International Hunt for His Assassin",Hampton Sides,"Sides, Hampton",,"=""0385523920""","=""9780385523929""",0,4.32,Doubleday,Hardcover,397,2010,2010,,2024/09/22,to-read,to-read (#328),to-read,,,,0,0
11305364,Area 51: An Uncensored History of America's Top Secret Military Base,Annie Jacobsen,"Jacobsen, Annie",,"=""0316132942""","=""9780316132947""",0,3.83,"Little, Brown and Company",Hardcover,540,2011,2011,,2024/09/22,to-read,to-read (#330),to-read,,,,0,0
95777,At Canaan's Edge: America in the King Years 1965-68,Taylor Branch,"Branch, Taylor",,"=""0684857138""","=""9780684857138""",0,4.43,Simon  Schuster,Paperback,1039,2007,2006,,2024/09/22,to-read,to-read (#324),to-read,,,,0,0
128824,Batavia's Graveyard: The True Story of the Mad Heretic Who Led History's Bloodiest Mutiny,Mike Dash,"Dash, Mike",,"=""0609807161""","=""9780609807163""",0,4.16,Crown,Paperback,512,2003,2002,,2024/09/22,to-read,to-read (#319),to-read,,,,0,0
252193,"An Uncommon Woman - The Empress Frederick: Daughter of Queen Victoria, Wife of the Crown Prince of Prussia, Mother of Kaiser Wilhelm",Hannah Pakula,"Pakula, Hannah",,"=""0684842165""","=""9780684842165""",0,4.19,Simon & Schuster,Paperback,704,1997,1995,,2024/09/22,to-read,to-read (#323),to-read,,,,0,0
321173,The Civilization of the Middle Ages,Norman F. Cantor,"Cantor, Norman F.",,"=""0060925531""","=""9780060925536""",0,3.95,Harper Perennial,Paperback,624,1994,1963,,2024/09/22,to-read,to-read (#322),to-read,,,,0,0
961462,Victorian London: The Tale of a City 1840-1870,Liza Picard,"Picard, Liza",,"=""0753820900""","=""9780753820902""",0,4.03,Phoenix House,Paperback,496,2006,2005,,2024/09/22,to-read,to-read (#320),to-read,,,,0,0
16121,"Titan: The Life of John D. Rockefeller, Sr.",Ron Chernow,"Chernow, Ron",,"=""1400077303""","=""9781400077304""",0,4.17,Vintage,Paperback,832,2004,1998,,2024/09/22,to-read,to-read (#321),to-read,,,,0,0
118690,This Kind of War: A Study in Unpreparedness,T.R. Fehrenbach,"Fehrenbach, T.R.",,"=""1574883348""","=""9781574883343""",0,4.16,POTOMAC BOOKS,Paperback,540,2001,1963,,2024/09/22,to-read,to-read (#316),to-read,,,,0,0
7098,"Terrible Swift Sword: The Centennial History of the Civil War Series, Volume 2",Bruce Catton,"Catton, Bruce",,"=""1842122932""","=""9781842122938""",0,4.39,Phoenix,Paperback,558,2001,1962,,2024/09/22,to-read,to-read (#318),to-read,,,,0,0
371301,Great Siege: Malta 1565 (Wordsworth Military Library.),Ernle Bradford,"Bradford, Ernle",,"=""1840222069""","=""9781840222067""",0,4.37,Wordsworth Editions Ltd,Paperback,256,1999,1961,,2024/09/22,to-read,to-read (#317),to-read,,,,0,0
3872,A History of the World in 6 Glasses,Tom Standage,"Standage, Tom",,"=""0802715524""","=""9780802715524""",0,3.80,Bloomsbury,Paperback,336,2006,2005,,2024/09/22,to-read,to-read (#309),to-read,,,,0,0
487339,Women in the Middle Ages,Frances Gies,"Gies, Frances",Joseph Gies,"=""0060923040""","=""9780060923044""",0,3.76,Harper Perennial,Paperback,272,2018,1978,,2024/09/22,to-read,to-read (#310),to-read,,,,0,0
625177,Black Sea,Neal Ascherson,"Ascherson, Neal",,"=""0809015935""","=""9780809015931""",0,3.95,Hill and Wang,Paperback,320,1996,1995,,2024/09/22,to-read,to-read (#314),to-read,,,,0,0
